{"basis":"held_in","basis_verified":false,"candidate_id":"synthetic-event-change","claims":[{"claim_id":"event","effect":"disqualifying","policy_digest":"sha256:536ffd59f2961c5f2f450aff82e0940319bb4a4280ca87837c696f784b46270d","read":{"digest":"sha256:7a13ee35e4a1d006184b27af09cfe68c96ec9037abbf023415d027cfee3bd20b","profile":"binary-event-directional.v1","reason_codes":["favorable_threshold_crossed"],"schema":"read.v2","verdict":"pass"},"semantic_digest":"sha256:38aa1561c1fe293c27505baa3a05521be0c1cba96134d65c0c73572250447f0b","subject_id":"synthetic.event-rate"},{"claim_id":"secondary","effect":"validity","policy_digest":"sha256:0b1d43783d1f184439850e8006ee2cc0dc8ab02ffbb1276cbd14467cdffe3767","read":{"digest":"sha256:e08e32c25f014f1d3bd914ec000f659b65832fe74204098dd2200b216e93fd65","profile":"binary-event-directional.v1","reason_codes":["favorable_threshold_crossed"],"schema":"read.v2","verdict":"pass"},"semantic_digest":"sha256:b3adf20efcc8a267e2b9a912f892535bee4654e324f85f79054e4cffc3a6c571","subject_id":"synthetic.secondary-event-rate"}],"classification":"screened","from_state":"proposed","human_review":"required","inputs":{"candidate_digest":"sha256:36d8bf7ec3adf9b8d0cc31d5d2197e86a57bb524e1bb4be767f983db17ce6ddc","claims_digest":"sha256:c37fac2cfd42ac1a4d6e3555a800e048afd574be074ff7a95aa82dbcee35955d","read_digests":["sha256:7a13ee35e4a1d006184b27af09cfe68c96ec9037abbf023415d027cfee3bd20b","sha256:e08e32c25f014f1d3bd914ec000f659b65832fe74204098dd2200b216e93fd65"]},"limitations":["basis_self_declared","claims_sealing_is_digest_binding","hard_failures_declared","read_not_bound_to_candidate","reads_trusted_as_supplied","semantic_digest_binds_declaration_only","split_parameters_author_chosen","supplied_calculations_not_independently_verified"],"merge_authorized":false,"next_state":"screened","reason_codes":["stage_screened"],"schema":"acceptance_decision.v2","selection":{"case_count":3,"confirm_fraction":0.2}}
